{
  "style_id": "style_composed_grid",
  "version": "1.0",
  "style_name": "编排网格",
  "tags": ["结构化", "均衡"],
  "best_for": ["对比", "审核"],
  "avoid_for": ["单焦点强表现"],
  "composition": "有序模块化网格，并具备清晰层级",
  "visual_language": {
    "materiality": ["干净表面", "受控对比", "精准边缘"],
    "lighting": "均匀照明，并带有轻微层次分离",
    "camera": "正向审核视角",
    "density": "中等",
    "scheme": "中性基础色，并搭配克制强调色"
  },
  "risk_notes": ["如果层级较弱，画面可能显得过于静态。"],
  "negative_elements": ["视觉杂乱", "未验证标签"],
  "reference_assets": [],
  "status": "approved"
}
