{
  "style_id": "style_spatial_layers",
  "version": "1.0",
  "style_name": "空间层次",
  "tags": ["环境感", "分层"],
  "best_for": ["上下文预览", "尺度讨论"],
  "avoid_for": ["纯平面审核"],
  "composition": "前景、中景和背景分层，并锚定内容",
  "visual_language": {
    "materiality": ["哑光质感", "环境反射", "纵深线索"],
    "lighting": "柔和面光，并保留可读阴影",
    "camera": "四分之三空间视图",
    "density": "中等",
    "scheme": "自然中性色，并搭配受控对比强调色"
  },
  "risk_notes": ["透视可能暗示未确认的尺寸信息。"],
  "negative_elements": ["未确认比例标记", "未批准素材复现"],
  "reference_assets": [],
  "status": "approved"
}
